{
  "answer": "Example answer grounded in retrieved material.",
  "citations": [
    {
      "chunk_id": "11111111-1111-4111-8111-111111111111",
      "document_id": "22222222-2222-4222-8222-222222222222",
      "quote": "First line from the chunk used as evidence."
    }
  ],
  "confidence": "medium",
  "mode": "extractive",
  "retrieved_chunk_ids": ["11111111-1111-4111-8111-111111111111"]
}
